{
  "schema_version": "compat_profile.v1",
  "id": "minecraft-java",
  "display_name": "Minecraft Java TCP",
  "road_scope": "direct_lan_local_port_only",
  "steam_lobby_supported": false,
  "requires_game_launch_args": false,
  "match": [
    "minecraft",
    "javaw",
    "java"
  ],
  "exe_names": [
    "minecraft.exe",
    "javaw.exe",
    "java.exe"
  ],
  "steam_app_ids": [],
  "exe_hashes": {},
  "plugin_name": "minecraft",
  "network": "tcp",
  "target_host": "127.0.0.1",
  "target_port": 25565,
  "client_listen_port": 25568,
  "udp_peer_broadcast": false,
  "known_ports": [
    {
      "network": "tcp",
      "port": 25565,
      "role": "target",
      "notes": "Minecraft Java server TCP port"
    },
    {
      "network": "tcp",
      "port": 25568,
      "role": "client_listen",
      "notes": "Suggested local ROAD client listen port"
    }
  ],
  "note_keys": [
    "studio.profile.java.note.tcp",
    "studio.profile.java.note.listen_port"
  ],
  "launch_advice_keys": []
}
